{
    "$schema": "http://json-schema.org/draft-07/schema#",
    "title": "Category",
    "type": "object",
    "required": ["id", "title", "description"],
    "properties": {
      "id": {
        "type": "string",
        "pattern": "^[a-z0-9-]+$",
        "description": "Unique identifier for the category"
      },
      "title": {
        "type": "string",
        "description": "Display name of the category"
      },
      "description": {
        "type": "string",
        "description": "Detailed description of the category"
      },
      "subcategories": {
        "type": "array",
        "items": {
          "type": "string"
        },
        "description": "List of subcategory IDs in this category"
      },
      "keyBenefits": {
        "type": "array",
        "items": {
          "type": "string"
        },
        "description": "Key benefits of this technology category"
      },
      "additionalSections": {
        "type": "object",
        "description": "Additional sections to display on the category page"
      }
    }
  }