{
    "id": "cloud",
    "title": "Cloud Computing",
    "description": "Cloud computing delivers computing services over the internet, providing on-demand access to resources like computing power, storage, and databases without direct active management by the user. It enables businesses to scale resources elastically, optimize costs through a pay-as-you-go model, and focus on their core business rather than infrastructure management.",
    "subcategories": [
      "public-cloud",
      "private-cloud",
      "hybrid-cloud",
      "serverless",
      "cloud-management"
    ],
    "keyBenefits": [
      "Flexibility: Scale resources up or down based on demand",
      "Cost Efficiency: Reduce capital expenses with pay-as-you-go pricing",
      "Global Reach: Deploy applications worldwide in minutes",
      "Reliability: Built-in redundancy and disaster recovery capabilities",
      "Security: Benefit from cloud providers' security investments and expertise",
      "Innovation: Quickly access new technologies without infrastructure investments"
    ],
    "additionalSections": {
      "Cloud Service Models": "Cloud computing services are typically delivered through three primary models:\n\n1. **Infrastructure as a Service (IaaS)**: Provides virtualized computing resources over the internet (e.g., virtual machines, storage, networks)\n2. **Platform as a Service (PaaS)**: Offers hardware and software tools over the internet, typically for application development\n3. **Software as a Service (SaaS)**: Delivers software applications over the internet, on a subscription basis",
      "Cloud Adoption Strategy": "Successfully adopting cloud technologies requires:\n\n1. **Assessment**: Evaluate current infrastructure and application portfolio\n2. **Planning**: Develop a roadmap for migration and transformation\n3. **Skills Development**: Train teams on cloud technologies and practices\n4. **Governance**: Establish policies for cost management, security, and compliance\n5. **Operations**: Implement cloud-native operations and monitoring"
    }
  }